{
  "$schema": "https://json-schema.org/draft/2020-12/schema",
  "$id": "https://lenso.dev/schemas/lenso.plan-state.v1.schema.json",
  "title": "Lenso immutable release plan state",
  "type": "object",
  "additionalProperties": false,
  "allOf": [
    {
      "if": { "properties": { "status": { "enum": ["ready", "publishing"] } }, "required": ["status"] },
      "then": { "required": ["environment"] }
    }
  ],
  "required": ["schema", "repository", "planId", "planSha256", "sourceCommit", "releaseCommit", "status", "reason", "evidence", "packages", "receipts", "attempts", "outbox", "occupancyKeys", "executionRef", "revision", "previousBlobSha", "createdAt", "updatedAt"],
  "properties": {
    "schema": { "const": "lenso.plan-state.v1" },
    "environment": { "enum": ["shadow", "production"] },
    "repository": { "type": "string", "pattern": "^[A-Za-z0-9][A-Za-z0-9._-]{0,99}/[A-Za-z0-9][A-Za-z0-9._-]{0,99}$" },
    "planId": { "$ref": "#/$defs/sha256" },
    "planSha256": { "$ref": "#/$defs/sha256" },
    "sourceCommit": { "$ref": "#/$defs/oid" },
    "releaseCommit": { "$ref": "#/$defs/oid" },
    "status": { "enum": ["ready", "publishing", "blocked", "verified"] },
    "reason": { "type": ["string", "null"] },
    "evidence": { "type": "array", "items": { "type": "object", "additionalProperties": false, "required": ["kind", "url", "digest"], "properties": { "kind": { "type": "string" }, "url": { "type": ["string", "null"] }, "digest": { "type": ["string", "null"] } } } },
    "packages": { "type": "array", "items": { "type": "object", "additionalProperties": false, "required": ["id", "version", "phase", "status", "requestEventId"], "properties": { "id": { "type": "string", "pattern": "^(cargo|npm):" }, "version": { "type": "string" }, "phase": { "type": "integer", "minimum": 0 }, "status": { "enum": ["pending", "dispatched", "received"] }, "requestEventId": { "oneOf": [{ "$ref": "#/$defs/sha256" }, { "type": "null" }] } } } },
    "receipts": { "type": "array", "items": { "$ref": "lenso.component-receipt.v1.schema.json" } },
    "attempts": { "type": "array", "items": { "type": "object", "additionalProperties": false, "required": ["eventId", "kind", "at", "outcome", "detail"], "properties": { "eventId": { "$ref": "#/$defs/sha256" }, "kind": { "enum": ["ready", "dispatch", "receipt", "recovery", "cancel"] }, "at": { "type": "string", "format": "date-time" }, "outcome": { "enum": ["accepted", "duplicate", "conflict", "blocked"] }, "detail": { "type": ["string", "null"] } } } },
    "outbox": { "type": "array", "items": { "type": "object", "additionalProperties": false, "required": ["eventId", "nonce", "ref", "workflow", "packages", "inputs", "status", "claimOwner", "leaseExpiresAt", "runUrl", "createdAt", "updatedAt"], "properties": { "eventId": { "$ref": "#/$defs/sha256" }, "nonce": { "type": "string", "minLength": 1 }, "ref": { "type": "string", "pattern": "^[A-Za-z0-9][A-Za-z0-9._/-]{0,254}$" }, "workflow": { "type": "string" }, "recovery": { "type": "object", "additionalProperties": false, "required": ["kind", "authorizedRunUrl", "authorizedRunSha256", "workflowCommit"], "properties": { "kind": { "const": "production-break-glass" }, "authorizedRunUrl": { "type": "string", "pattern": "^https://github\\.com/[A-Za-z0-9._-]+/[A-Za-z0-9._-]+/actions/runs/[1-9][0-9]*$" }, "authorizedRunSha256": { "$ref": "#/$defs/sha256" }, "workflowCommit": { "$ref": "#/$defs/oid" } } }, "packages": { "type": "array" }, "inputs": { "type": "object", "additionalProperties": false, "required": ["event_id", "plan_id", "plan_sha256", "release_commit", "packages_json", "nonce"], "properties": { "event_id": { "$ref": "#/$defs/sha256" }, "plan_id": { "$ref": "#/$defs/sha256" }, "plan_sha256": { "$ref": "#/$defs/sha256" }, "release_commit": { "$ref": "#/$defs/oid" }, "packages_json": { "type": "string" }, "nonce": { "type": "string", "minLength": 1 } } }, "status": { "enum": ["pending", "in-flight", "dispatched", "cancelled"] }, "claimOwner": { "type": ["string", "null"] }, "leaseExpiresAt": { "type": ["string", "null"], "format": "date-time" }, "runUrl": { "type": ["string", "null"] }, "createdAt": { "type": "string", "format": "date-time" }, "updatedAt": { "type": "string", "format": "date-time" } } } },
    "occupancyKeys": { "type": "array", "items": { "type": "string" }, "uniqueItems": true },
    "executionRef": { "type": "object", "additionalProperties": false, "required": ["name", "tip", "protected"], "properties": { "name": { "type": "string", "pattern": "^release-execution/[0-9a-f]{64}$" }, "tip": { "$ref": "#/$defs/oid" }, "protected": { "const": true } } },
    "revision": { "type": "integer", "minimum": 0 },
    "previousBlobSha": { "oneOf": [{ "$ref": "#/$defs/oid" }, { "type": "null" }] },
    "createdAt": { "type": "string", "format": "date-time" },
    "updatedAt": { "type": "string", "format": "date-time" }
  },
  "$defs": {
    "sha256": { "type": "string", "pattern": "^sha256:[0-9a-f]{64}$" },
    "oid": { "type": "string", "pattern": "^[0-9a-f]{40}$" }
  }
}
