{"attempts":[{"at":"2026-07-22T18:40:32.219Z","detail":null,"eventId":"sha256:8a41ce144a6e4dff854eeab2a52a08cfa9028eb46dd62e7b7f2605e786bb2bed","kind":"ready","outcome":"accepted"},{"at":"2026-07-22T18:40:49.843Z","detail":null,"eventId":"sha256:9c7be51e97c35aca41f267d8a97c17e534ff94cd5856fae205f80064e6d490d9","kind":"dispatch","outcome":"accepted"},{"at":"2026-07-22T18:57:08.111Z","detail":"retired failed shadow dispatch","eventId":"sha256:7f70f48748f73ae4cd79dd2d7809eb4b22296f65d772318eda8c4405b0eb1b54","kind":"cancel","outcome":"accepted"}],"createdAt":"2026-07-22T18:40:32.219Z","evidence":[{"digest":"git:fcbb31cb5f84623e8650f82f949cf0900ac650a6","kind":"execution-ref-protected","url":null}],"executionRef":{"name":"release-execution/1c7cb3d7293e9fcb8e9f45f8a0e5715c861da20fba3e856e0ff11b25199b8e95","protected":true,"tip":"fcbb31cb5f84623e8650f82f949cf0900ac650a6"},"occupancyKeys":[],"outbox":[{"claimOwner":null,"createdAt":"2026-07-22T18:40:32.219Z","eventId":"sha256:9c7be51e97c35aca41f267d8a97c17e534ff94cd5856fae205f80064e6d490d9","inputs":{"event_id":"sha256:9c7be51e97c35aca41f267d8a97c17e534ff94cd5856fae205f80064e6d490d9","nonce":"0b067c37-2e26-4e5c-b24e-325fca441a2c","packages_json":"[{\"id\":\"cargo:lenso-cli\",\"version\":\"0.2.1\"},{\"id\":\"npm:@lenso/cli\",\"version\":\"0.2.1\"}]","plan_id":"sha256:1c7cb3d7293e9fcb8e9f45f8a0e5715c861da20fba3e856e0ff11b25199b8e95","plan_sha256":"sha256:24b18254da04a3c8d3d760339615a447a44e03f504c127aa4d95da9102898c12","release_commit":"fcbb31cb5f84623e8650f82f949cf0900ac650a6"},"leaseExpiresAt":null,"nonce":"0b067c37-2e26-4e5c-b24e-325fca441a2c","packages":[{"id":"cargo:lenso-cli","version":"0.2.1"},{"id":"npm:@lenso/cli","version":"0.2.1"}],"ref":"release-execution/1c7cb3d7293e9fcb8e9f45f8a0e5715c861da20fba3e856e0ff11b25199b8e95","runUrl":"https://github.com/LioRael/lenso-cli/actions/runs/29947719227","status":"dispatched","updatedAt":"2026-07-22T18:40:49.843Z","workflow":".github/workflows/publish.yml"}],"packages":[{"id":"cargo:lenso-cli","phase":0,"requestEventId":"sha256:9c7be51e97c35aca41f267d8a97c17e534ff94cd5856fae205f80064e6d490d9","status":"dispatched","version":"0.2.1"},{"id":"npm:@lenso/cli","phase":0,"requestEventId":"sha256:9c7be51e97c35aca41f267d8a97c17e534ff94cd5856fae205f80064e6d490d9","status":"dispatched","version":"0.2.1"}],"planId":"sha256:1c7cb3d7293e9fcb8e9f45f8a0e5715c861da20fba3e856e0ff11b25199b8e95","planSha256":"sha256:24b18254da04a3c8d3d760339615a447a44e03f504c127aa4d95da9102898c12","previousBlobSha":"c3887a549694be8921de144e5af6a1fec615f1c5","reason":"retired failed shadow dispatch","receipts":[],"releaseCommit":"fcbb31cb5f84623e8650f82f949cf0900ac650a6","repository":"LioRael/lenso-cli","revision":3,"schema":"lenso.plan-state.v1","sourceCommit":"310775ba2dc0d6b494508615293628633e4470c2","status":"blocked","updatedAt":"2026-07-22T18:57:08.111Z"}