{"attempts":[{"at":"2026-07-22T20:47:16.569Z","detail":null,"eventId":"sha256:44d6d7f028e300c687078391caa587e4f23357075d19bff2735c1e416846fcd7","kind":"ready","outcome":"accepted"},{"at":"2026-07-22T20:47:42.929Z","detail":null,"eventId":"sha256:bfa9ae820f3a6ef956e848d1b0831e57e280b663820beeda0b84886afecad4dd","kind":"dispatch","outcome":"accepted"},{"at":"2026-07-22T21:23:19.274Z","detail":"retry failed shadow dispatch","eventId":"sha256:20ac8bd39342e9a7f8d8c2953b7c8e365c0d1a2abfe3b78a12a98f26bfde4cb3","kind":"recovery","outcome":"accepted"},{"at":"2026-07-22T21:26:12.195Z","detail":null,"eventId":"sha256:20ac8bd39342e9a7f8d8c2953b7c8e365c0d1a2abfe3b78a12a98f26bfde4cb3","kind":"dispatch","outcome":"accepted"},{"at":"2026-07-22T21:30:21.074Z","detail":null,"eventId":"sha256:40fbddec6f63119ef3dab810b00b9eac76dcca7b09b88e0f9dcd395134b3effc","kind":"receipt","outcome":"accepted"},{"at":"2026-07-22T21:31:20.245Z","detail":null,"eventId":"sha256:9083197f5cb474d3ba2a388909ebd1ff0f2c61169bad1f05b11308fdc8a7f285","kind":"receipt","outcome":"accepted"}],"createdAt":"2026-07-22T20:47:16.569Z","evidence":[{"digest":"git:85f1b4d849d0e06c4e8c5214317fe82b7b8ffe33","kind":"execution-ref-protected","url":null}],"executionRef":{"name":"release-execution/5084c1bc6947e45ad64f4294e65302657d17115201662ffa66a45202b9ad044a","protected":true,"tip":"85f1b4d849d0e06c4e8c5214317fe82b7b8ffe33"},"occupancyKeys":[],"outbox":[{"claimOwner":null,"createdAt":"2026-07-22T21:23:19.274Z","eventId":"sha256:20ac8bd39342e9a7f8d8c2953b7c8e365c0d1a2abfe3b78a12a98f26bfde4cb3","inputs":{"event_id":"sha256:20ac8bd39342e9a7f8d8c2953b7c8e365c0d1a2abfe3b78a12a98f26bfde4cb3","nonce":"686632a4-28fa-4f92-9d04-cc6bd58bf908","packages_json":"[{\"id\":\"cargo:lenso-cli\",\"version\":\"0.2.8\"},{\"id\":\"npm:@lenso/cli\",\"version\":\"0.2.8\"}]","plan_id":"sha256:5084c1bc6947e45ad64f4294e65302657d17115201662ffa66a45202b9ad044a","plan_sha256":"sha256:cdc018bce4c1267d6b243b04fce886cded2289508cdfe27f519ebbcb5b5380e6","release_commit":"85f1b4d849d0e06c4e8c5214317fe82b7b8ffe33"},"leaseExpiresAt":null,"nonce":"686632a4-28fa-4f92-9d04-cc6bd58bf908","packages":[{"id":"cargo:lenso-cli","version":"0.2.8"},{"id":"npm:@lenso/cli","version":"0.2.8"}],"ref":"release-execution/5084c1bc6947e45ad64f4294e65302657d17115201662ffa66a45202b9ad044a","runUrl":"https://github.com/LioRael/lenso-cli/actions/runs/29959088214","status":"dispatched","updatedAt":"2026-07-22T21:26:12.195Z","workflow":".github/workflows/publish.yml"},{"claimOwner":null,"createdAt":"2026-07-22T20:47:16.569Z","eventId":"sha256:bfa9ae820f3a6ef956e848d1b0831e57e280b663820beeda0b84886afecad4dd","inputs":{"event_id":"sha256:bfa9ae820f3a6ef956e848d1b0831e57e280b663820beeda0b84886afecad4dd","nonce":"e888f33c-7909-4fb8-9593-d22719550be1","packages_json":"[{\"id\":\"cargo:lenso-cli\",\"version\":\"0.2.8\"},{\"id\":\"npm:@lenso/cli\",\"version\":\"0.2.8\"}]","plan_id":"sha256:5084c1bc6947e45ad64f4294e65302657d17115201662ffa66a45202b9ad044a","plan_sha256":"sha256:cdc018bce4c1267d6b243b04fce886cded2289508cdfe27f519ebbcb5b5380e6","release_commit":"85f1b4d849d0e06c4e8c5214317fe82b7b8ffe33"},"leaseExpiresAt":null,"nonce":"e888f33c-7909-4fb8-9593-d22719550be1","packages":[{"id":"cargo:lenso-cli","version":"0.2.8"},{"id":"npm:@lenso/cli","version":"0.2.8"}],"ref":"release-execution/5084c1bc6947e45ad64f4294e65302657d17115201662ffa66a45202b9ad044a","runUrl":"https://github.com/LioRael/lenso-cli/actions/runs/29956604157","status":"dispatched","updatedAt":"2026-07-22T20:47:42.929Z","workflow":".github/workflows/publish.yml"}],"packages":[{"id":"cargo:lenso-cli","phase":0,"requestEventId":"sha256:20ac8bd39342e9a7f8d8c2953b7c8e365c0d1a2abfe3b78a12a98f26bfde4cb3","status":"received","version":"0.2.8"},{"id":"npm:@lenso/cli","phase":0,"requestEventId":"sha256:20ac8bd39342e9a7f8d8c2953b7c8e365c0d1a2abfe3b78a12a98f26bfde4cb3","status":"received","version":"0.2.8"}],"planId":"sha256:5084c1bc6947e45ad64f4294e65302657d17115201662ffa66a45202b9ad044a","planSha256":"sha256:cdc018bce4c1267d6b243b04fce886cded2289508cdfe27f519ebbcb5b5380e6","previousBlobSha":"04c79f191dfee838c0de2f0d1b9a63456b1c75fa","reason":null,"receipts":[{"environment":"shadow","packageId":"cargo:lenso-cli","packedSha256":"sha256:db1e6c9f348545a126bedddc49b8531f06b543b8d05a8d17b15eba9174a0b37a","planId":"sha256:5084c1bc6947e45ad64f4294e65302657d17115201662ffa66a45202b9ad044a","provenanceSubject":{"digest":"sha256:db1e6c9f348545a126bedddc49b8531f06b543b8d05a8d17b15eba9174a0b37a","name":"lenso-cli-0.2.8.crate"},"provenanceUrl":"https://lenso-release-shadow-gateway.lenso.workers.dev/attestations/a38ad952e686ca0396070a61adca28cd20051385531142b8c21866c29a5cb018","publishedAt":"2026-07-22T20:50:09.456Z","receiptId":"sha256:ecd5fb2c65e5bfb10bbd59a39c58177dfc9d60c6fdf273ebc7bda511eeaeee61","registryIntegrity":"db1e6c9f348545a126bedddc49b8531f06b543b8d05a8d17b15eba9174a0b37a","registryUrl":"https://lenso-release-shadow-gateway.lenso.workers.dev/cargo/api/v1/crates/lenso-cli/0.2.8/download","repository":"LioRael/lenso-cli","schema":"lenso.component-receipt.v1","sourceCommit":"85f1b4d849d0e06c4e8c5214317fe82b7b8ffe33","tagUrl":"https://github.com/LioRael/lenso-cli/releases/tag/lenso-cli%400.2.8","version":"0.2.8","workflowUrl":"https://github.com/LioRael/lenso-cli/actions/runs/29959088214"},{"environment":"shadow","packageId":"npm:@lenso/cli","packedSha256":"sha256:4d476fab16c9b3496c8feb8fdbebec2d5fce08020676208e727e020e609ba7f8","planId":"sha256:5084c1bc6947e45ad64f4294e65302657d17115201662ffa66a45202b9ad044a","provenanceSubject":{"digest":"sha256:4d476fab16c9b3496c8feb8fdbebec2d5fce08020676208e727e020e609ba7f8","name":"cli-0.2.8.tgz"},"provenanceUrl":"https://lenso-release-shadow-gateway.lenso.workers.dev/attestations/86eeeb32b30e33a2315c9eeb436c07cb5e4384d68233e0bafc47b93d166422a0","publishedAt":"2026-07-22T21:29:41.277Z","receiptId":"sha256:9083197f5cb474d3ba2a388909ebd1ff0f2c61169bad1f05b11308fdc8a7f285","registryIntegrity":"sha512-xNZnvHVbma2L+y7vtXmu22RtHqTDQvt2P+DwViWmSeQrUOcpuVT7l2dH7Ae4pDa82kIHCeWZCS4CZxUk1GYUzg==","registryUrl":"https://lenso-release-shadow-gateway.lenso.workers.dev/npm/tarballs/%40lenso%2Fcli/0.2.8.tgz","repository":"LioRael/lenso-cli","schema":"lenso.component-receipt.v1","sourceCommit":"85f1b4d849d0e06c4e8c5214317fe82b7b8ffe33","tagUrl":"https://github.com/LioRael/lenso-cli/releases/tag/cli%400.2.8","version":"0.2.8","workflowUrl":"https://github.com/LioRael/lenso-cli/actions/runs/29959088214"}],"releaseCommit":"85f1b4d849d0e06c4e8c5214317fe82b7b8ffe33","repository":"LioRael/lenso-cli","revision":7,"schema":"lenso.plan-state.v1","sourceCommit":"c88b9b604327f564f1af27c63fa2351904322218","status":"verified","updatedAt":"2026-07-22T21:31:20.245Z"}