{"attempts":[{"at":"2026-07-11T14:12:31.540Z","detail":null,"eventId":"sha256:5110162e39cfbbdcb76114421278e007e08c297091af4c60eec5d158137fa36b","kind":"ready","outcome":"accepted"}],"createdAt":"2026-07-11T14:12:31.540Z","evidence":[{"digest":"git:a5344f3f5794482ddb5522d61729e52c118a6d6c","kind":"execution-ref-protected","url":null}],"executionRef":{"name":"release-execution/a528f938509e5c8875a291156a144ce3637e7e15babd759346fb4fb54ddbdc2e","protected":true,"tip":"a5344f3f5794482ddb5522d61729e52c118a6d6c"},"occupancyKeys":["package:cargo:lenso-module-audit-log:0.1.2","plan:LioRael/lenso-audit-log-module:sha256:a528f938509e5c8875a291156a144ce3637e7e15babd759346fb4fb54ddbdc2e"],"outbox":[{"claimOwner":"fb1e56f8-0d8c-40d3-b067-47783a17fcec","createdAt":"2026-07-11T14:12:31.540Z","eventId":"sha256:3bcadb5426da8be7f2f08db35d2f86a631f562e4265ddd21ac135e5042524119","inputs":{"event_id":"sha256:3bcadb5426da8be7f2f08db35d2f86a631f562e4265ddd21ac135e5042524119","nonce":"e0a56fd7-ea04-4da0-ba18-49b6bb91158c","packages_json":"[{\"id\":\"cargo:lenso-module-audit-log\",\"version\":\"0.1.2\"}]","plan_id":"sha256:a528f938509e5c8875a291156a144ce3637e7e15babd759346fb4fb54ddbdc2e","plan_sha256":"sha256:939b75d88f55546689e081da70bfe3a0f41af061333af4ba41bd7ba94b6368be","release_commit":"a5344f3f5794482ddb5522d61729e52c118a6d6c"},"leaseExpiresAt":"2026-07-11T14:17:36.000Z","nonce":"e0a56fd7-ea04-4da0-ba18-49b6bb91158c","packages":[{"id":"cargo:lenso-module-audit-log","version":"0.1.2"}],"ref":"release-execution/a528f938509e5c8875a291156a144ce3637e7e15babd759346fb4fb54ddbdc2e","runUrl":null,"status":"in-flight","updatedAt":"2026-07-11T14:12:36.000Z","workflow":".github/workflows/publish.yml"}],"packages":[{"id":"cargo:lenso-module-audit-log","phase":0,"requestEventId":"sha256:3bcadb5426da8be7f2f08db35d2f86a631f562e4265ddd21ac135e5042524119","status":"dispatched","version":"0.1.2"}],"planId":"sha256:a528f938509e5c8875a291156a144ce3637e7e15babd759346fb4fb54ddbdc2e","planSha256":"sha256:939b75d88f55546689e081da70bfe3a0f41af061333af4ba41bd7ba94b6368be","previousBlobSha":"48a814a3cc03be02c79ed1ae2a86f6286216e73c","reason":null,"receipts":[],"releaseCommit":"a5344f3f5794482ddb5522d61729e52c118a6d6c","repository":"LioRael/lenso-audit-log-module","revision":1,"schema":"lenso.plan-state.v1","sourceCommit":"9c388c22ec5d8f87c7f8fd58dbe1d71d889b9eeb","status":"publishing","updatedAt":"2026-07-11T14:12:36.000Z"}