{"attempts":[{"at":"2026-07-22T12:27:44.151Z","detail":null,"eventId":"sha256:7a7e4b1616348070e5b7b2255cd50f83da03d3629a8c90f9682a7939382a1f29","kind":"ready","outcome":"accepted"},{"at":"2026-07-22T12:28:02.448Z","detail":null,"eventId":"sha256:ff15ed80b2464bd21139731bfc1ef404ba3d8d29b547df158f511d5c4b55a09a","kind":"dispatch","outcome":"accepted"},{"at":"2026-07-22T12:39:46.262Z","detail":"retired failed shadow dispatch","eventId":"sha256:ddbd5b261ac2e4861b194b4b4e1e85ab6adbadaf1c8587fbf2c995d0588cd469","kind":"cancel","outcome":"accepted"}],"createdAt":"2026-07-22T12:27:44.151Z","evidence":[{"digest":"git:f6c01a5bafd6dfe7d27f0f155610199afe689b63","kind":"execution-ref-protected","url":null}],"executionRef":{"name":"release-execution/44ed44322914a234f70f28faa22ac4368ff1ccec4064b2b77a7a8bf7ff025d92","protected":true,"tip":"f6c01a5bafd6dfe7d27f0f155610199afe689b63"},"occupancyKeys":[],"outbox":[{"claimOwner":null,"createdAt":"2026-07-22T12:27:44.151Z","eventId":"sha256:ff15ed80b2464bd21139731bfc1ef404ba3d8d29b547df158f511d5c4b55a09a","inputs":{"event_id":"sha256:ff15ed80b2464bd21139731bfc1ef404ba3d8d29b547df158f511d5c4b55a09a","nonce":"7804804e-21f0-4254-ac45-9313e5e3aa52","packages_json":"[{\"id\":\"cargo:lenso-contracts\",\"version\":\"0.3.7\"}]","plan_id":"sha256:44ed44322914a234f70f28faa22ac4368ff1ccec4064b2b77a7a8bf7ff025d92","plan_sha256":"sha256:b988bc113cbd79cbc4dfbbd9c09cb5693dc1be12bfa86f60c93cbe7225af643a","release_commit":"f6c01a5bafd6dfe7d27f0f155610199afe689b63"},"leaseExpiresAt":null,"nonce":"7804804e-21f0-4254-ac45-9313e5e3aa52","packages":[{"id":"cargo:lenso-contracts","version":"0.3.7"}],"ref":"release-execution/44ed44322914a234f70f28faa22ac4368ff1ccec4064b2b77a7a8bf7ff025d92","runUrl":"https://github.com/LioRael/lenso/actions/runs/29919725807","status":"dispatched","updatedAt":"2026-07-22T12:28:02.448Z","workflow":".github/workflows/publish.yml"}],"packages":[{"id":"cargo:lenso-api","phase":6,"requestEventId":null,"status":"pending","version":"0.1.15"},{"id":"cargo:lenso-autonomous-service","phase":3,"requestEventId":null,"status":"pending","version":"0.1.2"},{"id":"cargo:lenso-bootstrap","phase":5,"requestEventId":null,"status":"pending","version":"0.1.14"},{"id":"cargo:lenso-contracts","phase":0,"requestEventId":"sha256:ff15ed80b2464bd21139731bfc1ef404ba3d8d29b547df158f511d5c4b55a09a","status":"dispatched","version":"0.3.7"},{"id":"cargo:lenso-migrate","phase":6,"requestEventId":null,"status":"pending","version":"0.1.13"},{"id":"cargo:lenso-module-story","phase":4,"requestEventId":null,"status":"pending","version":"0.1.6"},{"id":"cargo:lenso-platform-admin-data","phase":4,"requestEventId":null,"status":"pending","version":"0.1.12"},{"id":"cargo:lenso-platform-admin","phase":4,"requestEventId":null,"status":"pending","version":"0.1.7"},{"id":"cargo:lenso-platform-core","phase":1,"requestEventId":null,"status":"pending","version":"0.1.7"},{"id":"cargo:lenso-platform-http","phase":2,"requestEventId":null,"status":"pending","version":"0.1.6"},{"id":"cargo:lenso-platform-module-remote","phase":4,"requestEventId":null,"status":"pending","version":"0.1.7"},{"id":"cargo:lenso-platform-module","phase":3,"requestEventId":null,"status":"pending","version":"0.1.7"},{"id":"cargo:lenso-platform-runtime","phase":2,"requestEventId":null,"status":"pending","version":"0.1.4"},{"id":"cargo:lenso-platform-testing","phase":2,"requestEventId":null,"status":"pending","version":"0.1.3"},{"id":"cargo:lenso-service","phase":1,"requestEventId":null,"status":"pending","version":"0.1.6"},{"id":"cargo:lenso-worker","phase":6,"requestEventId":null,"status":"pending","version":"0.1.13"},{"id":"cargo:lenso","phase":7,"requestEventId":null,"status":"pending","version":"0.3.21"}],"planId":"sha256:44ed44322914a234f70f28faa22ac4368ff1ccec4064b2b77a7a8bf7ff025d92","planSha256":"sha256:b988bc113cbd79cbc4dfbbd9c09cb5693dc1be12bfa86f60c93cbe7225af643a","previousBlobSha":"33ddfb8380726cfb8feba39ad6d6ee8c6b726cb0","reason":"retired failed shadow dispatch","receipts":[],"releaseCommit":"f6c01a5bafd6dfe7d27f0f155610199afe689b63","repository":"LioRael/lenso","revision":3,"schema":"lenso.plan-state.v1","sourceCommit":"a83d65967ecfa66c0e76ccb3a0690cdc1c5943af","status":"blocked","updatedAt":"2026-07-22T12:39:46.262Z"}