{"attempts":[{"at":"2026-07-11T14:32:20.688Z","detail":null,"eventId":"sha256:ca84084ba27d443f2a3a7b04a0f044212a261af91da279df255cc7891c976143","kind":"ready","outcome":"accepted"},{"at":"2026-07-11T14:40:29.301Z","detail":null,"eventId":"sha256:3382f7ed7b74060474132110bc054f3295fbe3c7715b833c1504a113e93e0e18","kind":"dispatch","outcome":"accepted"},{"at":"2026-07-11T14:48:49.083Z","detail":null,"eventId":"sha256:06fe7a58932a66cacdce00e35b35cbed8f8625b47e68856399045ce142e7a3b9","kind":"receipt","outcome":"accepted"}],"createdAt":"2026-07-11T14:32:20.688Z","evidence":[{"digest":"git:a2c3e0cb49275732afa340d5a7de02c0c2850f58","kind":"execution-ref-protected","url":null}],"executionRef":{"name":"release-execution/4e45fd1685d79b1686f8524f3e7ae6789521da7bc3f13b6807c5d21d9eb193ea","protected":true,"tip":"a2c3e0cb49275732afa340d5a7de02c0c2850f58"},"occupancyKeys":[],"outbox":[{"claimOwner":null,"createdAt":"2026-07-11T14:32:20.688Z","eventId":"sha256:3382f7ed7b74060474132110bc054f3295fbe3c7715b833c1504a113e93e0e18","inputs":{"event_id":"sha256:3382f7ed7b74060474132110bc054f3295fbe3c7715b833c1504a113e93e0e18","nonce":"f52cbe60-fb5a-4df1-bda3-fc578a68f7b9","packages_json":"[{\"id\":\"cargo:lenso-module-audit-log\",\"version\":\"0.1.3\"}]","plan_id":"sha256:4e45fd1685d79b1686f8524f3e7ae6789521da7bc3f13b6807c5d21d9eb193ea","plan_sha256":"sha256:25b3e00ed28baccebc8a45ebefb405e8ef1166240c8c7ba8e213e2d7429e00b1","release_commit":"a2c3e0cb49275732afa340d5a7de02c0c2850f58"},"leaseExpiresAt":null,"nonce":"f52cbe60-fb5a-4df1-bda3-fc578a68f7b9","packages":[{"id":"cargo:lenso-module-audit-log","version":"0.1.3"}],"ref":"release-execution/4e45fd1685d79b1686f8524f3e7ae6789521da7bc3f13b6807c5d21d9eb193ea","runUrl":"https://github.com/LioRael/lenso-audit-log-module/actions/runs/29156329638","status":"dispatched","updatedAt":"2026-07-11T14:40:29.301Z","workflow":".github/workflows/publish.yml"}],"packages":[{"id":"cargo:lenso-module-audit-log","phase":0,"requestEventId":"sha256:3382f7ed7b74060474132110bc054f3295fbe3c7715b833c1504a113e93e0e18","status":"received","version":"0.1.3"}],"planId":"sha256:4e45fd1685d79b1686f8524f3e7ae6789521da7bc3f13b6807c5d21d9eb193ea","planSha256":"sha256:25b3e00ed28baccebc8a45ebefb405e8ef1166240c8c7ba8e213e2d7429e00b1","previousBlobSha":"dac5b9fdeba7611ce98a3adb88c1174b5abef160","reason":null,"receipts":[{"environment":"shadow","packageId":"cargo:lenso-module-audit-log","packedSha256":"sha256:939ec64781cf3e5fdaab439649c2d2f34215c8858dc2b40be879ebc12370ed01","planId":"sha256:4e45fd1685d79b1686f8524f3e7ae6789521da7bc3f13b6807c5d21d9eb193ea","provenanceSubject":{"digest":"sha256:939ec64781cf3e5fdaab439649c2d2f34215c8858dc2b40be879ebc12370ed01","name":"lenso-module-audit-log-0.1.3.crate"},"provenanceUrl":"https://lenso-release-shadow-gateway.lenso.workers.dev/attestations/759abc386f2583dd6b426616eb10c114bcd9e2a6ec7d4473b8f97f12c479a2dc","publishedAt":"2026-07-11T14:34:59.032Z","receiptId":"sha256:06fe7a58932a66cacdce00e35b35cbed8f8625b47e68856399045ce142e7a3b9","registryIntegrity":"939ec64781cf3e5fdaab439649c2d2f34215c8858dc2b40be879ebc12370ed01","registryUrl":"https://lenso-release-shadow-gateway.lenso.workers.dev/cargo/api/v1/crates/lenso-module-audit-log/0.1.3/download","repository":"LioRael/lenso-audit-log-module","schema":"lenso.component-receipt.v1","sourceCommit":"a2c3e0cb49275732afa340d5a7de02c0c2850f58","tagUrl":"https://github.com/LioRael/lenso-audit-log-module/releases/tag/lenso-module-audit-log%400.1.3","version":"0.1.3","workflowUrl":"https://github.com/LioRael/lenso-audit-log-module/actions/runs/29156329638"}],"releaseCommit":"a2c3e0cb49275732afa340d5a7de02c0c2850f58","repository":"LioRael/lenso-audit-log-module","revision":5,"schema":"lenso.plan-state.v1","sourceCommit":"d0c2bcaff0bbfa73f7ac112c4ec61782f59cb9b8","status":"verified","updatedAt":"2026-07-11T14:48:49.083Z"}