{"attempts":[{"at":"2026-07-11T19:23:43.702Z","detail":null,"eventId":"sha256:a407ad3f7f8eba1f53ecff5e1fd2f38b4327d46b119f651914059f3ccdcfc047","kind":"ready","outcome":"accepted"},{"at":"2026-07-11T19:27:52.782Z","detail":null,"eventId":"sha256:fd635f7e832daa7cd78d50cb3f641e71f7f1eac53f2d4a19e6ba0f6739b26a1a","kind":"dispatch","outcome":"accepted"}],"createdAt":"2026-07-11T19:23:43.702Z","evidence":[{"digest":"git:2ad777cf2f0f043d73c1480818aad6d729e879bb","kind":"execution-ref-protected","url":null}],"executionRef":{"name":"release-execution/d6fcf06536d631b11ecfd3873fa92ed42f6196e5709b3c70fae5cb89b4e0f642","protected":true,"tip":"2ad777cf2f0f043d73c1480818aad6d729e879bb"},"occupancyKeys":["package:cargo:lenso-api:0.1.13","package:cargo:lenso-bootstrap:0.1.12","package:cargo:lenso-migrate:0.1.11","package:cargo:lenso-platform-admin-data:0.1.10","package:cargo:lenso-service:0.1.1","package:cargo:lenso-worker:0.1.11","package:cargo:lenso:0.3.19","plan:LioRael/lenso:sha256:d6fcf06536d631b11ecfd3873fa92ed42f6196e5709b3c70fae5cb89b4e0f642"],"outbox":[{"claimOwner":null,"createdAt":"2026-07-11T19:23:43.702Z","eventId":"sha256:fd635f7e832daa7cd78d50cb3f641e71f7f1eac53f2d4a19e6ba0f6739b26a1a","inputs":{"event_id":"sha256:fd635f7e832daa7cd78d50cb3f641e71f7f1eac53f2d4a19e6ba0f6739b26a1a","nonce":"9488d2d7-36e5-427d-87e1-fc8c242b503b","packages_json":"[{\"id\":\"cargo:lenso-service\",\"version\":\"0.1.1\"},{\"id\":\"cargo:lenso\",\"version\":\"0.3.19\"}]","plan_id":"sha256:d6fcf06536d631b11ecfd3873fa92ed42f6196e5709b3c70fae5cb89b4e0f642","plan_sha256":"sha256:dec5f8faaac3d75a65f8c8958bb0836bc1b36a3d40090d6f161a211bb1e20037","release_commit":"2ad777cf2f0f043d73c1480818aad6d729e879bb"},"leaseExpiresAt":null,"nonce":"9488d2d7-36e5-427d-87e1-fc8c242b503b","packages":[{"id":"cargo:lenso-service","version":"0.1.1"},{"id":"cargo:lenso","version":"0.3.19"}],"ref":"release-execution/d6fcf06536d631b11ecfd3873fa92ed42f6196e5709b3c70fae5cb89b4e0f642","runUrl":"https://github.com/LioRael/lenso/actions/runs/29165233952","status":"dispatched","updatedAt":"2026-07-11T19:27:52.782Z","workflow":".github/workflows/publish.yml"}],"packages":[{"id":"cargo:lenso-api","phase":3,"requestEventId":null,"status":"pending","version":"0.1.13"},{"id":"cargo:lenso-bootstrap","phase":2,"requestEventId":null,"status":"pending","version":"0.1.12"},{"id":"cargo:lenso-migrate","phase":3,"requestEventId":null,"status":"pending","version":"0.1.11"},{"id":"cargo:lenso-platform-admin-data","phase":1,"requestEventId":null,"status":"pending","version":"0.1.10"},{"id":"cargo:lenso-service","phase":0,"requestEventId":"sha256:fd635f7e832daa7cd78d50cb3f641e71f7f1eac53f2d4a19e6ba0f6739b26a1a","status":"dispatched","version":"0.1.1"},{"id":"cargo:lenso-worker","phase":3,"requestEventId":null,"status":"pending","version":"0.1.11"},{"id":"cargo:lenso","phase":0,"requestEventId":"sha256:fd635f7e832daa7cd78d50cb3f641e71f7f1eac53f2d4a19e6ba0f6739b26a1a","status":"dispatched","version":"0.3.19"}],"planId":"sha256:d6fcf06536d631b11ecfd3873fa92ed42f6196e5709b3c70fae5cb89b4e0f642","planSha256":"sha256:dec5f8faaac3d75a65f8c8958bb0836bc1b36a3d40090d6f161a211bb1e20037","previousBlobSha":"5e95ce29a9cdf5d36682e4a9f5b4d348ee7d33c4","reason":null,"receipts":[],"releaseCommit":"2ad777cf2f0f043d73c1480818aad6d729e879bb","repository":"LioRael/lenso","revision":2,"schema":"lenso.plan-state.v1","sourceCommit":"f2d89c4def4175faaed88d01b2172f9f76995b4c","status":"publishing","updatedAt":"2026-07-11T19:27:52.782Z"}