{"attempts":[{"at":"2026-07-11T20:30:42.071Z","detail":null,"eventId":"sha256:f140929026d41c371255ccb3cee35e5d2984d800d2606984a018d8b53198686c","kind":"ready","outcome":"accepted"}],"createdAt":"2026-07-11T20:30:42.071Z","evidence":[{"digest":"git:bfb2504707c0542be04b089a9a63594277911b12","kind":"execution-ref-protected","url":null}],"executionRef":{"name":"release-execution/674d4f95f9e09c57c35484043cfc7b022b0db3830291240c2e69d8a6489449ed","protected":true,"tip":"bfb2504707c0542be04b089a9a63594277911b12"},"occupancyKeys":["package:cargo:lenso-api:0.1.13","package:cargo:lenso-bootstrap:0.1.12","package:cargo:lenso-migrate:0.1.11","package:cargo:lenso-platform-admin-data:0.1.10","package:cargo:lenso-service:0.1.1","package:cargo:lenso-worker:0.1.11","package:cargo:lenso:0.3.19","plan:LioRael/lenso:sha256:674d4f95f9e09c57c35484043cfc7b022b0db3830291240c2e69d8a6489449ed"],"outbox":[{"claimOwner":null,"createdAt":"2026-07-11T20:30:42.071Z","eventId":"sha256:21dda4cf8db49e739c44d87c56e41d0cf1a10495225e640f5d8113e5926946a4","inputs":{"event_id":"sha256:21dda4cf8db49e739c44d87c56e41d0cf1a10495225e640f5d8113e5926946a4","nonce":"efef223b-50c8-40da-9161-3f98976a85b2","packages_json":"[{\"id\":\"cargo:lenso-service\",\"version\":\"0.1.1\"}]","plan_id":"sha256:674d4f95f9e09c57c35484043cfc7b022b0db3830291240c2e69d8a6489449ed","plan_sha256":"sha256:ebe24e5497f993b63153ecfb552211422e0a45dad69962b79ce0d1937238020f","release_commit":"bfb2504707c0542be04b089a9a63594277911b12"},"leaseExpiresAt":null,"nonce":"efef223b-50c8-40da-9161-3f98976a85b2","packages":[{"id":"cargo:lenso-service","version":"0.1.1"}],"ref":"release-execution/674d4f95f9e09c57c35484043cfc7b022b0db3830291240c2e69d8a6489449ed","runUrl":null,"status":"pending","updatedAt":"2026-07-11T20:30:42.071Z","workflow":".github/workflows/publish.yml"}],"packages":[{"id":"cargo:lenso-api","phase":3,"requestEventId":null,"status":"pending","version":"0.1.13"},{"id":"cargo:lenso-bootstrap","phase":2,"requestEventId":null,"status":"pending","version":"0.1.12"},{"id":"cargo:lenso-migrate","phase":3,"requestEventId":null,"status":"pending","version":"0.1.11"},{"id":"cargo:lenso-platform-admin-data","phase":1,"requestEventId":null,"status":"pending","version":"0.1.10"},{"id":"cargo:lenso-service","phase":0,"requestEventId":"sha256:21dda4cf8db49e739c44d87c56e41d0cf1a10495225e640f5d8113e5926946a4","status":"dispatched","version":"0.1.1"},{"id":"cargo:lenso-worker","phase":3,"requestEventId":null,"status":"pending","version":"0.1.11"},{"id":"cargo:lenso","phase":4,"requestEventId":null,"status":"pending","version":"0.3.19"}],"planId":"sha256:674d4f95f9e09c57c35484043cfc7b022b0db3830291240c2e69d8a6489449ed","planSha256":"sha256:ebe24e5497f993b63153ecfb552211422e0a45dad69962b79ce0d1937238020f","previousBlobSha":null,"reason":null,"receipts":[],"releaseCommit":"bfb2504707c0542be04b089a9a63594277911b12","repository":"LioRael/lenso","revision":0,"schema":"lenso.plan-state.v1","sourceCommit":"1975cb9a7ef8fbba0cc198db6aaaac2633e99681","status":"publishing","updatedAt":"2026-07-11T20:30:42.071Z"}