{"attempts":[{"at":"2026-07-24T10:01:08.290Z","detail":null,"eventId":"sha256:feec241fa773d2400d56e706fe2f381ddcdd13dc254a720935f1bc2abf921d88","kind":"ready","outcome":"accepted"},{"at":"2026-07-24T10:01:43.330Z","detail":null,"eventId":"sha256:5f946a9ffca22a1cb43d0c0d6483758cf63e43db57a1658cad50794e9de4b842","kind":"dispatch","outcome":"accepted"},{"at":"2026-07-24T10:15:18.022Z","detail":null,"eventId":"sha256:bc7aac3ba4bd367d65caa1dc3aea4ac0df5d3a1f45967c1826115a771bc554e0","kind":"receipt","outcome":"accepted"},{"at":"2026-07-24T10:16:13.043Z","detail":null,"eventId":"sha256:53cb21328a042a3285945eda6b210b2882799c7f023b0143c3252f6f0dcaddd8","kind":"receipt","outcome":"accepted"}],"createdAt":"2026-07-24T10:01:08.290Z","environment":"shadow","evidence":[{"digest":"git:2bd8263ae08dce9f0195c65e712a5815762a91fa","kind":"execution-ref-protected","url":null}],"executionRef":{"name":"release-execution/2c970522f1d84a54cf7bc37f65b96c3ca8a0e2a3dd128b01cad81fb0faa0c4e9","protected":true,"tip":"2bd8263ae08dce9f0195c65e712a5815762a91fa"},"occupancyKeys":[],"outbox":[{"claimOwner":null,"createdAt":"2026-07-24T10:01:08.290Z","eventId":"sha256:5f946a9ffca22a1cb43d0c0d6483758cf63e43db57a1658cad50794e9de4b842","inputs":{"event_id":"sha256:5f946a9ffca22a1cb43d0c0d6483758cf63e43db57a1658cad50794e9de4b842","nonce":"3cc7e436-f353-4356-8395-05063cc2c8d1","packages_json":"[{\"id\":\"cargo:lenso-cli\",\"version\":\"0.2.12\"},{\"id\":\"npm:@lenso/cli\",\"version\":\"0.2.12\"}]","plan_id":"sha256:2c970522f1d84a54cf7bc37f65b96c3ca8a0e2a3dd128b01cad81fb0faa0c4e9","plan_sha256":"sha256:ecfa0ee27cde60d8954ca5c2d3c61ab21beacacbf2dbbb0b4c47a369ecd8d347","release_commit":"2bd8263ae08dce9f0195c65e712a5815762a91fa"},"leaseExpiresAt":null,"nonce":"3cc7e436-f353-4356-8395-05063cc2c8d1","packages":[{"id":"cargo:lenso-cli","version":"0.2.12"},{"id":"npm:@lenso/cli","version":"0.2.12"}],"ref":"release-execution/2c970522f1d84a54cf7bc37f65b96c3ca8a0e2a3dd128b01cad81fb0faa0c4e9","runUrl":"https://github.com/LioRael/lenso-cli/actions/runs/30084715832","status":"dispatched","updatedAt":"2026-07-24T10:01:43.330Z","workflow":".github/workflows/publish.yml"}],"packages":[{"id":"cargo:lenso-cli","phase":0,"requestEventId":"sha256:5f946a9ffca22a1cb43d0c0d6483758cf63e43db57a1658cad50794e9de4b842","status":"received","version":"0.2.12"},{"id":"npm:@lenso/cli","phase":0,"requestEventId":"sha256:5f946a9ffca22a1cb43d0c0d6483758cf63e43db57a1658cad50794e9de4b842","status":"received","version":"0.2.12"}],"planId":"sha256:2c970522f1d84a54cf7bc37f65b96c3ca8a0e2a3dd128b01cad81fb0faa0c4e9","planSha256":"sha256:ecfa0ee27cde60d8954ca5c2d3c61ab21beacacbf2dbbb0b4c47a369ecd8d347","previousBlobSha":"850ccfe9ab7efe168d490d38dda200e73b3eaf21","reason":null,"receipts":[{"environment":"shadow","packageId":"cargo:lenso-cli","packedSha256":"sha256:24e84e503ca65d8b1985a1b00c5105e160f2839f8087ac395a710d7913c5fc27","planId":"sha256:2c970522f1d84a54cf7bc37f65b96c3ca8a0e2a3dd128b01cad81fb0faa0c4e9","provenanceSubject":{"digest":"sha256:24e84e503ca65d8b1985a1b00c5105e160f2839f8087ac395a710d7913c5fc27","name":"lenso-cli-0.2.12.crate"},"provenanceUrl":"https://lenso-release-shadow-gateway.lenso.workers.dev/attestations/72b19fdca60f1a67b7bc3c2828c8788f2aa01bf4e5de0912a75a1f814f82455c","publishedAt":"2026-07-24T10:14:10.919Z","receiptId":"sha256:f656269b1db3edaf442c0834e5249ba03908d7115b3b492eb5bac1485444d6f6","registryIntegrity":"24e84e503ca65d8b1985a1b00c5105e160f2839f8087ac395a710d7913c5fc27","registryUrl":"https://lenso-release-shadow-gateway.lenso.workers.dev/cargo/api/v1/crates/lenso-cli/0.2.12/download","repository":"LioRael/lenso-cli","schema":"lenso.component-receipt.v1","sourceCommit":"2bd8263ae08dce9f0195c65e712a5815762a91fa","tagUrl":"https://github.com/LioRael/lenso-cli/releases/tag/lenso-cli%400.2.12","version":"0.2.12","workflowUrl":"https://github.com/LioRael/lenso-cli/actions/runs/30084715832"},{"environment":"shadow","packageId":"npm:@lenso/cli","packedSha256":"sha256:6806c312fcb63a491ab6390b14824f4fca59098e2735c2cc9c53871c2177e714","planId":"sha256:2c970522f1d84a54cf7bc37f65b96c3ca8a0e2a3dd128b01cad81fb0faa0c4e9","provenanceSubject":{"digest":"sha256:6806c312fcb63a491ab6390b14824f4fca59098e2735c2cc9c53871c2177e714","name":"cli-0.2.12.tgz"},"provenanceUrl":"https://lenso-release-shadow-gateway.lenso.workers.dev/attestations/3f0081e1c3c0b1fd4582dd183f1d776c0536f9da38c96f7fc89e3915642e795d","publishedAt":"2026-07-24T10:14:22.501Z","receiptId":"sha256:53cb21328a042a3285945eda6b210b2882799c7f023b0143c3252f6f0dcaddd8","registryIntegrity":"sha512-6t5ys7R5mBc4gVNTt4UzX2juAoPOUVJPsSRbXcIxQOMfDAzF2chXBqctillnxAxy+l27u1/1g3yKdK3IQapITw==","registryUrl":"https://lenso-release-shadow-gateway.lenso.workers.dev/npm/tarballs/%40lenso%2Fcli/0.2.12.tgz","repository":"LioRael/lenso-cli","schema":"lenso.component-receipt.v1","sourceCommit":"2bd8263ae08dce9f0195c65e712a5815762a91fa","tagUrl":"https://github.com/LioRael/lenso-cli/releases/tag/cli%400.2.12","version":"0.2.12","workflowUrl":"https://github.com/LioRael/lenso-cli/actions/runs/30084715832"}],"releaseCommit":"2bd8263ae08dce9f0195c65e712a5815762a91fa","repository":"LioRael/lenso-cli","revision":4,"schema":"lenso.plan-state.v1","sourceCommit":"5ab70bed8cda80ed78f9adb783a234cb30248cc4","status":"verified","updatedAt":"2026-07-24T10:16:13.043Z"}