{"attempts":[{"at":"2026-07-24T09:07:06.682Z","detail":null,"eventId":"sha256:a6aa791a4d70243f32bc88fb361f35c5404400dcc635f853b025c8d0c307310a","kind":"ready","outcome":"accepted"},{"at":"2026-07-24T09:08:41.933Z","detail":null,"eventId":"sha256:7f04b4b238a6c2725d5a9de496c6ced5baaa8379a02133e6953f7baac91c53f0","kind":"dispatch","outcome":"accepted"},{"at":"2026-07-24T09:21:25.618Z","detail":null,"eventId":"sha256:4171e81db3d183f9d753ad24d92cafb6035397fc2c66bab049495a77ad44f110","kind":"receipt","outcome":"accepted"}],"createdAt":"2026-07-24T09:07:06.682Z","environment":"shadow","evidence":[{"digest":"git:855c916b23cc64237e2d295fe4babd919ddd993c","kind":"execution-ref-protected","url":null}],"executionRef":{"name":"release-execution/50af8b6ee94da3b24ab5e26d1b0f7edc1329a5858ba8f7f159ed8c9f602fe321","protected":true,"tip":"855c916b23cc64237e2d295fe4babd919ddd993c"},"occupancyKeys":[],"outbox":[{"claimOwner":null,"createdAt":"2026-07-24T09:07:06.682Z","eventId":"sha256:7f04b4b238a6c2725d5a9de496c6ced5baaa8379a02133e6953f7baac91c53f0","inputs":{"event_id":"sha256:7f04b4b238a6c2725d5a9de496c6ced5baaa8379a02133e6953f7baac91c53f0","nonce":"c1e6e494-4af4-4bf6-8f4d-03399c03f24b","packages_json":"[{\"id\":\"artifact:lenso-runtime-console\",\"version\":\"0.1.2\"}]","plan_id":"sha256:50af8b6ee94da3b24ab5e26d1b0f7edc1329a5858ba8f7f159ed8c9f602fe321","plan_sha256":"sha256:bab29c74cb2fd02e471d61ff89c0072fcdea65656ed0dafdd087c56913a8b255","release_commit":"855c916b23cc64237e2d295fe4babd919ddd993c"},"leaseExpiresAt":null,"nonce":"c1e6e494-4af4-4bf6-8f4d-03399c03f24b","packages":[{"id":"artifact:lenso-runtime-console","version":"0.1.2"}],"ref":"release-execution/50af8b6ee94da3b24ab5e26d1b0f7edc1329a5858ba8f7f159ed8c9f602fe321","runUrl":"https://github.com/LioRael/lenso-runtime-console/actions/runs/30081410764","status":"dispatched","updatedAt":"2026-07-24T09:08:41.933Z","workflow":".github/workflows/publish.yml"}],"packages":[{"id":"artifact:lenso-runtime-console","phase":0,"requestEventId":"sha256:7f04b4b238a6c2725d5a9de496c6ced5baaa8379a02133e6953f7baac91c53f0","status":"received","version":"0.1.2"}],"planId":"sha256:50af8b6ee94da3b24ab5e26d1b0f7edc1329a5858ba8f7f159ed8c9f602fe321","planSha256":"sha256:bab29c74cb2fd02e471d61ff89c0072fcdea65656ed0dafdd087c56913a8b255","previousBlobSha":"a8e9d52ff938ee3c9a7c704b0b207a0feda66cc0","reason":null,"receipts":[{"environment":"shadow","packageId":"artifact:lenso-runtime-console","packedSha256":"sha256:4a23380d910c1a3a7ff25e3fc10dc719fdb3efb5f069d5a10e013fea61d622ec","planId":"sha256:50af8b6ee94da3b24ab5e26d1b0f7edc1329a5858ba8f7f159ed8c9f602fe321","provenanceSubject":{"digest":"sha256:4a23380d910c1a3a7ff25e3fc10dc719fdb3efb5f069d5a10e013fea61d622ec","name":"lenso-runtime-console.tar.gz"},"provenanceUrl":"https://lenso-release-shadow-gateway.lenso.workers.dev/attestations/fbb0ef01ab955b74c4cc7652e4e33e8cc950d6c29d73ffa25f777270804fd323","publishedAt":"2026-07-24T09:10:11.337Z","receiptId":"sha256:4171e81db3d183f9d753ad24d92cafb6035397fc2c66bab049495a77ad44f110","registryIntegrity":"sha256:4a23380d910c1a3a7ff25e3fc10dc719fdb3efb5f069d5a10e013fea61d622ec","registryUrl":"https://lenso-release-shadow-gateway.lenso.workers.dev/github/assets/9","repository":"LioRael/lenso-runtime-console","schema":"lenso.component-receipt.v1","sourceCommit":"855c916b23cc64237e2d295fe4babd919ddd993c","tagUrl":"https://github.com/LioRael/lenso-runtime-console/releases/tag/lenso-runtime-console%400.1.2","version":"0.1.2","workflowUrl":"https://github.com/LioRael/lenso-runtime-console/actions/runs/30081410764"}],"releaseCommit":"855c916b23cc64237e2d295fe4babd919ddd993c","repository":"LioRael/lenso-runtime-console","revision":3,"schema":"lenso.plan-state.v1","sourceCommit":"b92a78ba2581ca76e306f4fd5c3d7f536465c006","status":"verified","updatedAt":"2026-07-24T09:21:25.618Z"}