{"attempts":[{"at":"2026-07-22T13:00:37.296Z","detail":null,"eventId":"sha256:524c55923d172972eb3844d228a0fe535126158f6e8c56b5a2a1b0c596bf7e9d","kind":"ready","outcome":"accepted"},{"at":"2026-07-22T13:05:16.767Z","detail":null,"eventId":"sha256:779b8df92357e72056d3766d7e750f6a761981db28fc035d1b1182ed5eea819d","kind":"dispatch","outcome":"accepted"},{"at":"2026-07-22T13:07:47.538Z","detail":null,"eventId":"sha256:6ec041344535f8115a9afef12f85927473cdfac29fa6b6e7ab78531304a3ea2a","kind":"receipt","outcome":"accepted"},{"at":"2026-07-22T13:08:03.913Z","detail":null,"eventId":"sha256:761842e5eed7bc52112ee738f060db82e72a39d9d49d968921819c7e364d28a8","kind":"dispatch","outcome":"accepted"},{"at":"2026-07-22T13:19:22.003Z","detail":"retired failed shadow dispatch","eventId":"sha256:daaf8a1bc047e412074598423a68675fa5c518829a4443f59adc98e532969d89","kind":"cancel","outcome":"accepted"}],"createdAt":"2026-07-22T13:00:37.296Z","evidence":[{"digest":"git:3310cac8f0b771829815137715aad4f39ea12d71","kind":"execution-ref-protected","url":null}],"executionRef":{"name":"release-execution/11c1f18ca8255cecbf1423459c99bb611344f8c9dc35ec2fbba46763e91ec85a","protected":true,"tip":"3310cac8f0b771829815137715aad4f39ea12d71"},"occupancyKeys":[],"outbox":[{"claimOwner":null,"createdAt":"2026-07-22T13:07:47.538Z","eventId":"sha256:761842e5eed7bc52112ee738f060db82e72a39d9d49d968921819c7e364d28a8","inputs":{"event_id":"sha256:761842e5eed7bc52112ee738f060db82e72a39d9d49d968921819c7e364d28a8","nonce":"b4f3c57a-bf46-48f5-9e09-e1983a630bd0","packages_json":"[{\"id\":\"cargo:lenso-platform-core\",\"version\":\"0.1.8\"},{\"id\":\"cargo:lenso-service\",\"version\":\"0.1.7\"}]","plan_id":"sha256:11c1f18ca8255cecbf1423459c99bb611344f8c9dc35ec2fbba46763e91ec85a","plan_sha256":"sha256:7a63a31a43b5cb275413650700729001630977b86eb1e1ccf1491d44c10fe795","release_commit":"3310cac8f0b771829815137715aad4f39ea12d71"},"leaseExpiresAt":null,"nonce":"b4f3c57a-bf46-48f5-9e09-e1983a630bd0","packages":[{"id":"cargo:lenso-platform-core","version":"0.1.8"},{"id":"cargo:lenso-service","version":"0.1.7"}],"ref":"release-execution/11c1f18ca8255cecbf1423459c99bb611344f8c9dc35ec2fbba46763e91ec85a","runUrl":"https://github.com/LioRael/lenso/actions/runs/29922554432","status":"dispatched","updatedAt":"2026-07-22T13:08:03.913Z","workflow":".github/workflows/publish.yml"},{"claimOwner":null,"createdAt":"2026-07-22T13:00:37.296Z","eventId":"sha256:779b8df92357e72056d3766d7e750f6a761981db28fc035d1b1182ed5eea819d","inputs":{"event_id":"sha256:779b8df92357e72056d3766d7e750f6a761981db28fc035d1b1182ed5eea819d","nonce":"e0f2824f-1a88-4839-a438-d23fb15449e2","packages_json":"[{\"id\":\"cargo:lenso-contracts\",\"version\":\"0.3.8\"}]","plan_id":"sha256:11c1f18ca8255cecbf1423459c99bb611344f8c9dc35ec2fbba46763e91ec85a","plan_sha256":"sha256:7a63a31a43b5cb275413650700729001630977b86eb1e1ccf1491d44c10fe795","release_commit":"3310cac8f0b771829815137715aad4f39ea12d71"},"leaseExpiresAt":null,"nonce":"e0f2824f-1a88-4839-a438-d23fb15449e2","packages":[{"id":"cargo:lenso-contracts","version":"0.3.8"}],"ref":"release-execution/11c1f18ca8255cecbf1423459c99bb611344f8c9dc35ec2fbba46763e91ec85a","runUrl":"https://github.com/LioRael/lenso/actions/runs/29922042679","status":"dispatched","updatedAt":"2026-07-22T13:05:16.767Z","workflow":".github/workflows/publish.yml"}],"packages":[{"id":"cargo:lenso-api","phase":6,"requestEventId":null,"status":"pending","version":"0.1.16"},{"id":"cargo:lenso-autonomous-service","phase":3,"requestEventId":null,"status":"pending","version":"0.1.3"},{"id":"cargo:lenso-bootstrap","phase":5,"requestEventId":null,"status":"pending","version":"0.1.15"},{"id":"cargo:lenso-contracts","phase":0,"requestEventId":"sha256:779b8df92357e72056d3766d7e750f6a761981db28fc035d1b1182ed5eea819d","status":"received","version":"0.3.8"},{"id":"cargo:lenso-migrate","phase":6,"requestEventId":null,"status":"pending","version":"0.1.14"},{"id":"cargo:lenso-module-story","phase":4,"requestEventId":null,"status":"pending","version":"0.1.7"},{"id":"cargo:lenso-platform-admin-data","phase":4,"requestEventId":null,"status":"pending","version":"0.1.13"},{"id":"cargo:lenso-platform-admin","phase":4,"requestEventId":null,"status":"pending","version":"0.1.8"},{"id":"cargo:lenso-platform-core","phase":1,"requestEventId":"sha256:761842e5eed7bc52112ee738f060db82e72a39d9d49d968921819c7e364d28a8","status":"dispatched","version":"0.1.8"},{"id":"cargo:lenso-platform-http","phase":2,"requestEventId":null,"status":"pending","version":"0.1.7"},{"id":"cargo:lenso-platform-module-remote","phase":4,"requestEventId":null,"status":"pending","version":"0.1.8"},{"id":"cargo:lenso-platform-module","phase":3,"requestEventId":null,"status":"pending","version":"0.1.8"},{"id":"cargo:lenso-platform-runtime","phase":2,"requestEventId":null,"status":"pending","version":"0.1.5"},{"id":"cargo:lenso-platform-testing","phase":2,"requestEventId":null,"status":"pending","version":"0.1.4"},{"id":"cargo:lenso-service","phase":1,"requestEventId":"sha256:761842e5eed7bc52112ee738f060db82e72a39d9d49d968921819c7e364d28a8","status":"dispatched","version":"0.1.7"},{"id":"cargo:lenso-worker","phase":6,"requestEventId":null,"status":"pending","version":"0.1.14"},{"id":"cargo:lenso","phase":7,"requestEventId":null,"status":"pending","version":"0.3.22"}],"planId":"sha256:11c1f18ca8255cecbf1423459c99bb611344f8c9dc35ec2fbba46763e91ec85a","planSha256":"sha256:7a63a31a43b5cb275413650700729001630977b86eb1e1ccf1491d44c10fe795","previousBlobSha":"7d6fea64def7b2f8a5f7263b8ade544d29c37cb1","reason":"retired failed shadow dispatch","receipts":[{"environment":"shadow","packageId":"cargo:lenso-contracts","packedSha256":"sha256:58cd6e0f5a9962325d51ce806587a153ff0180a10942604ded9c006722f29dd7","planId":"sha256:11c1f18ca8255cecbf1423459c99bb611344f8c9dc35ec2fbba46763e91ec85a","provenanceSubject":{"digest":"sha256:58cd6e0f5a9962325d51ce806587a153ff0180a10942604ded9c006722f29dd7","name":"lenso-contracts-0.3.8.crate"},"provenanceUrl":"https://lenso-release-shadow-gateway.lenso.workers.dev/attestations/c910f4c9db7f8b6eef0d810854ac725b3e3410ba00ddc816637eccda99fb2881","publishedAt":"2026-07-22T13:07:13.121Z","receiptId":"sha256:d96722857a6b987cac94079e1e0bbe322781c47edd38051b34e965509a20f311","registryIntegrity":"58cd6e0f5a9962325d51ce806587a153ff0180a10942604ded9c006722f29dd7","registryUrl":"https://lenso-release-shadow-gateway.lenso.workers.dev/cargo/api/v1/crates/lenso-contracts/0.3.8/download","repository":"LioRael/lenso","schema":"lenso.component-receipt.v1","sourceCommit":"3310cac8f0b771829815137715aad4f39ea12d71","tagUrl":"https://github.com/LioRael/lenso/releases/tag/lenso-contracts%400.3.8","version":"0.3.8","workflowUrl":"https://github.com/LioRael/lenso/actions/runs/29922042679"}],"releaseCommit":"3310cac8f0b771829815137715aad4f39ea12d71","repository":"LioRael/lenso","revision":6,"schema":"lenso.plan-state.v1","sourceCommit":"de528a0fb199318b2cd5598ba7bcd96eab2b3258","status":"blocked","updatedAt":"2026-07-22T13:19:22.003Z"}