{"attempts":[{"at":"2026-07-24T01:33:35.503Z","detail":null,"eventId":"sha256:d2c8a8cf9691b5d75616884dbde013b7b1a386c292a8a24da09952eae14d6c29","kind":"ready","outcome":"accepted"},{"at":"2026-07-24T01:43:52.963Z","detail":null,"eventId":"sha256:2ada1251b7f1f86020a2fcbf4b29e4c51f867d548c375c146af4ebb2e3cf2dfb","kind":"dispatch","outcome":"accepted"}],"createdAt":"2026-07-24T01:33:35.503Z","evidence":[{"digest":"git:1b5750a374cd0c21b27b67e1ea4ffd001fc7a347","kind":"execution-ref-protected","url":null}],"executionRef":{"name":"release-execution/81a22fe1960b4f7ba4942f71489513ec17e08b85a81515335b512f5f207d0504","protected":true,"tip":"1b5750a374cd0c21b27b67e1ea4ffd001fc7a347"},"occupancyKeys":["package:cargo:lenso-api:0.1.26","package:cargo:lenso-autonomous-service:0.1.10","package:cargo:lenso-bootstrap:0.1.25","package:cargo:lenso-contracts:0.3.15","package:cargo:lenso-migrate:0.1.24","package:cargo:lenso-module-story:0.1.17","package:cargo:lenso-platform-admin-data:0.1.20","package:cargo:lenso-platform-admin:0.1.15","package:cargo:lenso-platform-core:0.1.15","package:cargo:lenso-platform-http:0.1.14","package:cargo:lenso-platform-module-remote:0.1.15","package:cargo:lenso-platform-module:0.1.15","package:cargo:lenso-platform-runtime:0.1.12","package:cargo:lenso-platform-testing:0.1.11","package:cargo:lenso-service:0.1.14","package:cargo:lenso-worker:0.1.24","package:cargo:lenso:0.3.32","plan:LioRael/lenso:sha256:81a22fe1960b4f7ba4942f71489513ec17e08b85a81515335b512f5f207d0504"],"outbox":[{"claimOwner":null,"createdAt":"2026-07-24T01:33:35.503Z","eventId":"sha256:2ada1251b7f1f86020a2fcbf4b29e4c51f867d548c375c146af4ebb2e3cf2dfb","inputs":{"event_id":"sha256:2ada1251b7f1f86020a2fcbf4b29e4c51f867d548c375c146af4ebb2e3cf2dfb","nonce":"1f8039da-a13a-4f4f-a5b4-e702e64a0cb9","packages_json":"[{\"id\":\"cargo:lenso-contracts\",\"version\":\"0.3.15\"}]","plan_id":"sha256:81a22fe1960b4f7ba4942f71489513ec17e08b85a81515335b512f5f207d0504","plan_sha256":"sha256:a099834ecda977b4cccdb6c16f1c8a312774cd634d33df5d172a2692798d96f6","release_commit":"1b5750a374cd0c21b27b67e1ea4ffd001fc7a347"},"leaseExpiresAt":null,"nonce":"1f8039da-a13a-4f4f-a5b4-e702e64a0cb9","packages":[{"id":"cargo:lenso-contracts","version":"0.3.15"}],"ref":"release-execution/81a22fe1960b4f7ba4942f71489513ec17e08b85a81515335b512f5f207d0504","runUrl":"https://github.com/LioRael/lenso/actions/runs/30059299498","status":"dispatched","updatedAt":"2026-07-24T01:43:52.963Z","workflow":".github/workflows/publish.yml"}],"packages":[{"id":"cargo:lenso-api","phase":6,"requestEventId":null,"status":"pending","version":"0.1.26"},{"id":"cargo:lenso-autonomous-service","phase":3,"requestEventId":null,"status":"pending","version":"0.1.10"},{"id":"cargo:lenso-bootstrap","phase":5,"requestEventId":null,"status":"pending","version":"0.1.25"},{"id":"cargo:lenso-contracts","phase":0,"requestEventId":"sha256:2ada1251b7f1f86020a2fcbf4b29e4c51f867d548c375c146af4ebb2e3cf2dfb","status":"dispatched","version":"0.3.15"},{"id":"cargo:lenso-migrate","phase":6,"requestEventId":null,"status":"pending","version":"0.1.24"},{"id":"cargo:lenso-module-story","phase":4,"requestEventId":null,"status":"pending","version":"0.1.17"},{"id":"cargo:lenso-platform-admin-data","phase":4,"requestEventId":null,"status":"pending","version":"0.1.20"},{"id":"cargo:lenso-platform-admin","phase":4,"requestEventId":null,"status":"pending","version":"0.1.15"},{"id":"cargo:lenso-platform-core","phase":1,"requestEventId":null,"status":"pending","version":"0.1.15"},{"id":"cargo:lenso-platform-http","phase":2,"requestEventId":null,"status":"pending","version":"0.1.14"},{"id":"cargo:lenso-platform-module-remote","phase":4,"requestEventId":null,"status":"pending","version":"0.1.15"},{"id":"cargo:lenso-platform-module","phase":3,"requestEventId":null,"status":"pending","version":"0.1.15"},{"id":"cargo:lenso-platform-runtime","phase":2,"requestEventId":null,"status":"pending","version":"0.1.12"},{"id":"cargo:lenso-platform-testing","phase":2,"requestEventId":null,"status":"pending","version":"0.1.11"},{"id":"cargo:lenso-service","phase":1,"requestEventId":null,"status":"pending","version":"0.1.14"},{"id":"cargo:lenso-worker","phase":6,"requestEventId":null,"status":"pending","version":"0.1.24"},{"id":"cargo:lenso","phase":7,"requestEventId":null,"status":"pending","version":"0.3.32"}],"planId":"sha256:81a22fe1960b4f7ba4942f71489513ec17e08b85a81515335b512f5f207d0504","planSha256":"sha256:a099834ecda977b4cccdb6c16f1c8a312774cd634d33df5d172a2692798d96f6","previousBlobSha":"170a1adda60e009a13591ffddfe7149f8cf8ceac","reason":null,"receipts":[],"releaseCommit":"1b5750a374cd0c21b27b67e1ea4ffd001fc7a347","repository":"LioRael/lenso","revision":2,"schema":"lenso.plan-state.v1","sourceCommit":"5c0bd7a4558f996d8729a303f7f2b65bb0a6829f","status":"publishing","updatedAt":"2026-07-24T01:43:52.963Z"}