{"attempts":[{"at":"2026-07-24T09:48:32.681Z","detail":null,"eventId":"sha256:6d590cd75e64b426dd2da90380f1afec043cc47593810ef3fa2cd56d3ad2c2e7","kind":"ready","outcome":"accepted"},{"at":"2026-07-24T09:49:47.500Z","detail":null,"eventId":"sha256:94f20a3ac4ef8f292405ebee20bbfb631124914c0429f5d36f1b539b864339f7","kind":"dispatch","outcome":"accepted"},{"at":"2026-07-24T09:53:44.511Z","detail":"retired failed shadow dispatch","eventId":"sha256:eb6b6536f2d3af50df731e6940364dbce11d3a44673a63be891638adf5cc1e0d","kind":"cancel","outcome":"accepted"}],"createdAt":"2026-07-24T09:48:32.681Z","environment":"shadow","evidence":[{"digest":"git:38f98568e7ff7b1e8d3073d4218f523794fa8c55","kind":"execution-ref-protected","url":null}],"executionRef":{"name":"release-execution/def12e6a40ffd36e0459e3f5fac46b0a5652f5b04c47b6f56fabc59a30a60150","protected":true,"tip":"38f98568e7ff7b1e8d3073d4218f523794fa8c55"},"occupancyKeys":[],"outbox":[{"claimOwner":null,"createdAt":"2026-07-24T09:48:32.681Z","eventId":"sha256:94f20a3ac4ef8f292405ebee20bbfb631124914c0429f5d36f1b539b864339f7","inputs":{"event_id":"sha256:94f20a3ac4ef8f292405ebee20bbfb631124914c0429f5d36f1b539b864339f7","nonce":"77f3b2fe-5d86-4342-bc48-e75425255686","packages_json":"[{\"id\":\"cargo:lenso-cli\",\"version\":\"0.2.11\"},{\"id\":\"npm:@lenso/cli\",\"version\":\"0.2.11\"}]","plan_id":"sha256:def12e6a40ffd36e0459e3f5fac46b0a5652f5b04c47b6f56fabc59a30a60150","plan_sha256":"sha256:0913b60c6068e34ed5880515435853ed78549dd0a8983809b57a6eb5ed0445ef","release_commit":"38f98568e7ff7b1e8d3073d4218f523794fa8c55"},"leaseExpiresAt":null,"nonce":"77f3b2fe-5d86-4342-bc48-e75425255686","packages":[{"id":"cargo:lenso-cli","version":"0.2.11"},{"id":"npm:@lenso/cli","version":"0.2.11"}],"ref":"release-execution/def12e6a40ffd36e0459e3f5fac46b0a5652f5b04c47b6f56fabc59a30a60150","runUrl":"https://github.com/LioRael/lenso-cli/actions/runs/30083931449","status":"dispatched","updatedAt":"2026-07-24T09:49:47.500Z","workflow":".github/workflows/publish.yml"}],"packages":[{"id":"cargo:lenso-cli","phase":0,"requestEventId":"sha256:94f20a3ac4ef8f292405ebee20bbfb631124914c0429f5d36f1b539b864339f7","status":"dispatched","version":"0.2.11"},{"id":"npm:@lenso/cli","phase":0,"requestEventId":"sha256:94f20a3ac4ef8f292405ebee20bbfb631124914c0429f5d36f1b539b864339f7","status":"dispatched","version":"0.2.11"}],"planId":"sha256:def12e6a40ffd36e0459e3f5fac46b0a5652f5b04c47b6f56fabc59a30a60150","planSha256":"sha256:0913b60c6068e34ed5880515435853ed78549dd0a8983809b57a6eb5ed0445ef","previousBlobSha":"af820683e1ee1a5d73137192d624312f46aa95f4","reason":"retired failed shadow dispatch","receipts":[],"releaseCommit":"38f98568e7ff7b1e8d3073d4218f523794fa8c55","repository":"LioRael/lenso-cli","revision":3,"schema":"lenso.plan-state.v1","sourceCommit":"7d62da62035dee5c9a8afe7b4734f93323efc7ed","status":"blocked","updatedAt":"2026-07-24T09:53:44.511Z"}