{"attempts":[{"at":"2026-07-22T19:54:29.349Z","detail":null,"eventId":"sha256:120568120a99f6bcda55c992b1b24ebb5f1694b01178d47b02fce01102d59457","kind":"ready","outcome":"accepted"},{"at":"2026-07-22T19:55:48.149Z","detail":null,"eventId":"sha256:d4ee329786f2a5786749e744cfa70d53afa483dc60734ff860096fcd6926e521","kind":"dispatch","outcome":"accepted"},{"at":"2026-07-22T19:59:56.204Z","detail":"retired failed shadow dispatch","eventId":"sha256:987258e8c596c538b135f9d7f1e899f681c919650745383217131c8cf9e2ab58","kind":"cancel","outcome":"accepted"}],"createdAt":"2026-07-22T19:54:29.349Z","evidence":[{"digest":"git:1820bdb7fa0788c9edb636c4a6156a86f28ea65a","kind":"execution-ref-protected","url":null}],"executionRef":{"name":"release-execution/ae5e046cd6d95f5abc28d95d224d596978c90177cb1aaa823b9117dec65992e4","protected":true,"tip":"1820bdb7fa0788c9edb636c4a6156a86f28ea65a"},"occupancyKeys":[],"outbox":[{"claimOwner":null,"createdAt":"2026-07-22T19:54:29.349Z","eventId":"sha256:d4ee329786f2a5786749e744cfa70d53afa483dc60734ff860096fcd6926e521","inputs":{"event_id":"sha256:d4ee329786f2a5786749e744cfa70d53afa483dc60734ff860096fcd6926e521","nonce":"ab4d6154-3252-4bc4-bf27-7f1d8a4c9d29","packages_json":"[{\"id\":\"cargo:lenso-cli\",\"version\":\"0.2.5\"},{\"id\":\"npm:@lenso/cli\",\"version\":\"0.2.5\"}]","plan_id":"sha256:ae5e046cd6d95f5abc28d95d224d596978c90177cb1aaa823b9117dec65992e4","plan_sha256":"sha256:47e3bbda4261535e2696151eb5dc82ae01ca7e95b2f3bb2bd4aa43269944f58b","release_commit":"1820bdb7fa0788c9edb636c4a6156a86f28ea65a"},"leaseExpiresAt":null,"nonce":"ab4d6154-3252-4bc4-bf27-7f1d8a4c9d29","packages":[{"id":"cargo:lenso-cli","version":"0.2.5"},{"id":"npm:@lenso/cli","version":"0.2.5"}],"ref":"release-execution/ae5e046cd6d95f5abc28d95d224d596978c90177cb1aaa823b9117dec65992e4","runUrl":"https://github.com/LioRael/lenso-cli/actions/runs/29952947972","status":"dispatched","updatedAt":"2026-07-22T19:55:48.149Z","workflow":".github/workflows/publish.yml"}],"packages":[{"id":"cargo:lenso-cli","phase":0,"requestEventId":"sha256:d4ee329786f2a5786749e744cfa70d53afa483dc60734ff860096fcd6926e521","status":"dispatched","version":"0.2.5"},{"id":"npm:@lenso/cli","phase":0,"requestEventId":"sha256:d4ee329786f2a5786749e744cfa70d53afa483dc60734ff860096fcd6926e521","status":"dispatched","version":"0.2.5"}],"planId":"sha256:ae5e046cd6d95f5abc28d95d224d596978c90177cb1aaa823b9117dec65992e4","planSha256":"sha256:47e3bbda4261535e2696151eb5dc82ae01ca7e95b2f3bb2bd4aa43269944f58b","previousBlobSha":"c08d4c86167cfb7045df07430c74a2ec5fca765c","reason":"retired failed shadow dispatch","receipts":[],"releaseCommit":"1820bdb7fa0788c9edb636c4a6156a86f28ea65a","repository":"LioRael/lenso-cli","revision":3,"schema":"lenso.plan-state.v1","sourceCommit":"66eef10af089c7d7283b33f0949a3d42d2a85f5d","status":"blocked","updatedAt":"2026-07-22T19:59:56.204Z"}