{"attempts":[{"at":"2026-07-25T08:04:28.618Z","detail":null,"eventId":"sha256:bf8d4d341a4316176216fbe83991163797c91b77c675d5f7e485f193ccd99ee3","kind":"ready","outcome":"accepted"},{"at":"2026-07-25T08:08:24.609Z","detail":null,"eventId":"sha256:3b39a99cbea281493e66038d257c4b7808c3103743b6c05d54e6f89342d29dff","kind":"dispatch","outcome":"accepted"},{"at":"2026-07-25T11:45:17.170Z","detail":null,"eventId":"sha256:b98858dac9680a7ec4fb80b34d7ac9422f95a842efb4f5e56b089ea343b9a65a","kind":"receipt","outcome":"accepted"}],"createdAt":"2026-07-25T08:04:28.618Z","environment":"production","evidence":[{"digest":"git:2b70f630e2fb4b7c90543c5678fedfd78ca6124b","kind":"execution-ref-protected","url":null}],"executionRef":{"name":"release-execution/4e59fdb9215ebaad4a9ef8bb9e625f2e704144bc405074fb2337779ee3fdeffb","protected":true,"tip":"2b70f630e2fb4b7c90543c5678fedfd78ca6124b"},"occupancyKeys":[],"outbox":[{"claimOwner":null,"createdAt":"2026-07-25T08:04:28.618Z","eventId":"sha256:3b39a99cbea281493e66038d257c4b7808c3103743b6c05d54e6f89342d29dff","inputs":{"event_id":"sha256:3b39a99cbea281493e66038d257c4b7808c3103743b6c05d54e6f89342d29dff","nonce":"12dea21e-57bc-4012-9b7f-86324fcf01a9","packages_json":"[{\"id\":\"artifact:lenso-runtime-console\",\"version\":\"0.1.2\"}]","plan_id":"sha256:4e59fdb9215ebaad4a9ef8bb9e625f2e704144bc405074fb2337779ee3fdeffb","plan_sha256":"sha256:4b60f15559b12e0e226408131c56c83317edd981a7908a32a3a6f08f92424d6c","release_commit":"2b70f630e2fb4b7c90543c5678fedfd78ca6124b"},"leaseExpiresAt":null,"nonce":"12dea21e-57bc-4012-9b7f-86324fcf01a9","packages":[{"id":"artifact:lenso-runtime-console","version":"0.1.2"}],"ref":"release-execution/4e59fdb9215ebaad4a9ef8bb9e625f2e704144bc405074fb2337779ee3fdeffb","runUrl":"https://github.com/LioRael/lenso-runtime-console/actions/runs/30150464238","status":"dispatched","updatedAt":"2026-07-25T08:08:24.609Z","workflow":".github/workflows/publish.yml"}],"packages":[{"id":"artifact:lenso-runtime-console","phase":0,"requestEventId":"sha256:3b39a99cbea281493e66038d257c4b7808c3103743b6c05d54e6f89342d29dff","status":"received","version":"0.1.2"}],"planId":"sha256:4e59fdb9215ebaad4a9ef8bb9e625f2e704144bc405074fb2337779ee3fdeffb","planSha256":"sha256:4b60f15559b12e0e226408131c56c83317edd981a7908a32a3a6f08f92424d6c","previousBlobSha":"8d443649bbfbbd2e7342f4994c68e61500c103d7","reason":null,"receipts":[{"environment":"production","packageId":"artifact:lenso-runtime-console","packedSha256":"sha256:b9b153374a94d224f6fb9d873185581fe45af25e23c50d92a4b51ac23c0be30a","planId":"sha256:4e59fdb9215ebaad4a9ef8bb9e625f2e704144bc405074fb2337779ee3fdeffb","provenanceSubject":{"digest":"sha256:b9b153374a94d224f6fb9d873185581fe45af25e23c50d92a4b51ac23c0be30a","name":"lenso-runtime-console.tar.gz"},"provenanceUrl":"https://github.com/LioRael/lenso-runtime-console/attestations/b9b153374a94d224f6fb9d873185581fe45af25e23c50d92a4b51ac23c0be30a","publishedAt":"2026-07-25T07:46:59Z","receiptId":"sha256:b98858dac9680a7ec4fb80b34d7ac9422f95a842efb4f5e56b089ea343b9a65a","registryIntegrity":"sha256:b9b153374a94d224f6fb9d873185581fe45af25e23c50d92a4b51ac23c0be30a","registryUrl":"https://github.com/LioRael/lenso-runtime-console/releases/download/v0.1.2/lenso-runtime-console.tar.gz","repository":"LioRael/lenso-runtime-console","schema":"lenso.component-receipt.v1","sourceCommit":"2b70f630e2fb4b7c90543c5678fedfd78ca6124b","tagUrl":"https://github.com/LioRael/lenso-runtime-console/releases/tag/lenso-runtime-console%400.1.2","version":"0.1.2","workflowUrl":"https://github.com/LioRael/lenso-runtime-console/actions/runs/30156680665"}],"releaseCommit":"2b70f630e2fb4b7c90543c5678fedfd78ca6124b","repository":"LioRael/lenso-runtime-console","revision":3,"schema":"lenso.plan-state.v1","sourceCommit":"c4908d52253086a29b89d25cc322da94d18a4ab0","status":"verified","updatedAt":"2026-07-25T11:45:17.170Z"}