{"attempts":[{"at":"2026-07-11T19:03:04.613Z","detail":null,"eventId":"sha256:f39a7c588c5ee904965493bde25d302abc99b38822c9b53dfcf7fc0f5732a2e2","kind":"ready","outcome":"accepted"}],"createdAt":"2026-07-11T19:03:04.613Z","evidence":[{"digest":"git:958f1f5ebd27ba7a9d91827685d57c93dbf1c97f","kind":"execution-ref-protected","url":null}],"executionRef":{"name":"release-execution/b2ed531af9a5b3770a6e4d95e791ca96cb92a0d8de927d4da241f7a41ac19488","protected":true,"tip":"958f1f5ebd27ba7a9d91827685d57c93dbf1c97f"},"occupancyKeys":["package:cargo:lenso-api:0.1.13","package:cargo:lenso-bootstrap:0.1.12","package:cargo:lenso-migrate:0.1.11","package:cargo:lenso-platform-admin-data:0.1.10","package:cargo:lenso-service:0.1.1","package:cargo:lenso-worker:0.1.11","package:cargo:lenso:0.3.19","plan:LioRael/lenso:sha256:b2ed531af9a5b3770a6e4d95e791ca96cb92a0d8de927d4da241f7a41ac19488"],"outbox":[{"claimOwner":null,"createdAt":"2026-07-11T19:03:04.613Z","eventId":"sha256:33f4655257735353d62c010a225e9a9085cb0cd20b95d96f31acf288d89e7231","inputs":{"event_id":"sha256:33f4655257735353d62c010a225e9a9085cb0cd20b95d96f31acf288d89e7231","nonce":"e2db3b18-bc96-4053-8b34-be652f9e4856","packages_json":"[{\"id\":\"cargo:lenso-service\",\"version\":\"0.1.1\"},{\"id\":\"cargo:lenso\",\"version\":\"0.3.19\"}]","plan_id":"sha256:b2ed531af9a5b3770a6e4d95e791ca96cb92a0d8de927d4da241f7a41ac19488","plan_sha256":"sha256:3584a59b2e629b545b7d710a640c0bda4108edfb378d4ab1293085776c8f2be2","release_commit":"958f1f5ebd27ba7a9d91827685d57c93dbf1c97f"},"leaseExpiresAt":null,"nonce":"e2db3b18-bc96-4053-8b34-be652f9e4856","packages":[{"id":"cargo:lenso-service","version":"0.1.1"},{"id":"cargo:lenso","version":"0.3.19"}],"ref":"release-execution/b2ed531af9a5b3770a6e4d95e791ca96cb92a0d8de927d4da241f7a41ac19488","runUrl":null,"status":"pending","updatedAt":"2026-07-11T19:03:04.613Z","workflow":".github/workflows/publish.yml"}],"packages":[{"id":"cargo:lenso-api","phase":3,"requestEventId":null,"status":"pending","version":"0.1.13"},{"id":"cargo:lenso-bootstrap","phase":2,"requestEventId":null,"status":"pending","version":"0.1.12"},{"id":"cargo:lenso-migrate","phase":3,"requestEventId":null,"status":"pending","version":"0.1.11"},{"id":"cargo:lenso-platform-admin-data","phase":1,"requestEventId":null,"status":"pending","version":"0.1.10"},{"id":"cargo:lenso-service","phase":0,"requestEventId":"sha256:33f4655257735353d62c010a225e9a9085cb0cd20b95d96f31acf288d89e7231","status":"dispatched","version":"0.1.1"},{"id":"cargo:lenso-worker","phase":3,"requestEventId":null,"status":"pending","version":"0.1.11"},{"id":"cargo:lenso","phase":0,"requestEventId":"sha256:33f4655257735353d62c010a225e9a9085cb0cd20b95d96f31acf288d89e7231","status":"dispatched","version":"0.3.19"}],"planId":"sha256:b2ed531af9a5b3770a6e4d95e791ca96cb92a0d8de927d4da241f7a41ac19488","planSha256":"sha256:3584a59b2e629b545b7d710a640c0bda4108edfb378d4ab1293085776c8f2be2","previousBlobSha":"340a11bbcffb7dd57ec8f21d1e6ae60077d08793","reason":null,"receipts":[],"releaseCommit":"958f1f5ebd27ba7a9d91827685d57c93dbf1c97f","repository":"LioRael/lenso","revision":0,"schema":"lenso.plan-state.v1","sourceCommit":"07ca9cabafe6b50d8cf813d65f5a84da71fb2db2","status":"publishing","updatedAt":"2026-07-11T19:03:04.613Z"}