{"attempts":[{"at":"2026-07-24T01:13:44.621Z","detail":null,"eventId":"sha256:71ea9dee85d3e0a4e7419ab3bd3e982c4b51e67ac9a899773ddb57e5f29624eb","kind":"ready","outcome":"accepted"}],"createdAt":"2026-07-24T01:13:44.621Z","evidence":[{"digest":"git:5b17f574a5d314cc477fe2bf9f2c4906492d97c3","kind":"execution-ref-protected","url":null}],"executionRef":{"name":"release-execution/4ca5aa96fc46a935bbf9033fa3d857f3a85e786d734d8bf1f874130cc74201b6","protected":true,"tip":"5b17f574a5d314cc477fe2bf9f2c4906492d97c3"},"occupancyKeys":["package:cargo:lenso-cli:0.2.9","package:npm:@lenso/cli:0.2.9","plan:LioRael/lenso-cli:sha256:4ca5aa96fc46a935bbf9033fa3d857f3a85e786d734d8bf1f874130cc74201b6"],"outbox":[{"claimOwner":null,"createdAt":"2026-07-24T01:13:44.621Z","eventId":"sha256:3a951b8c9be08f8b4a3b674645bf9fb773b15f984ca72fe1ee8677d9d3dc55c4","inputs":{"event_id":"sha256:3a951b8c9be08f8b4a3b674645bf9fb773b15f984ca72fe1ee8677d9d3dc55c4","nonce":"d7167cd3-0924-4d37-8885-e0a0460278da","packages_json":"[{\"id\":\"cargo:lenso-cli\",\"version\":\"0.2.9\"},{\"id\":\"npm:@lenso/cli\",\"version\":\"0.2.9\"}]","plan_id":"sha256:4ca5aa96fc46a935bbf9033fa3d857f3a85e786d734d8bf1f874130cc74201b6","plan_sha256":"sha256:98c48b3a2d6ee06a1d4d99390d81ae383124ca4a153284e6cc78baf2afeaf850","release_commit":"5b17f574a5d314cc477fe2bf9f2c4906492d97c3"},"leaseExpiresAt":null,"nonce":"d7167cd3-0924-4d37-8885-e0a0460278da","packages":[{"id":"cargo:lenso-cli","version":"0.2.9"},{"id":"npm:@lenso/cli","version":"0.2.9"}],"ref":"release-execution/4ca5aa96fc46a935bbf9033fa3d857f3a85e786d734d8bf1f874130cc74201b6","runUrl":null,"status":"pending","updatedAt":"2026-07-24T01:13:44.621Z","workflow":".github/workflows/publish.yml"}],"packages":[{"id":"cargo:lenso-cli","phase":0,"requestEventId":"sha256:3a951b8c9be08f8b4a3b674645bf9fb773b15f984ca72fe1ee8677d9d3dc55c4","status":"dispatched","version":"0.2.9"},{"id":"npm:@lenso/cli","phase":0,"requestEventId":"sha256:3a951b8c9be08f8b4a3b674645bf9fb773b15f984ca72fe1ee8677d9d3dc55c4","status":"dispatched","version":"0.2.9"}],"planId":"sha256:4ca5aa96fc46a935bbf9033fa3d857f3a85e786d734d8bf1f874130cc74201b6","planSha256":"sha256:98c48b3a2d6ee06a1d4d99390d81ae383124ca4a153284e6cc78baf2afeaf850","previousBlobSha":null,"reason":null,"receipts":[],"releaseCommit":"5b17f574a5d314cc477fe2bf9f2c4906492d97c3","repository":"LioRael/lenso-cli","revision":0,"schema":"lenso.plan-state.v1","sourceCommit":"ad64663061d93828344d9dec40785f66d179d0ab","status":"publishing","updatedAt":"2026-07-24T01:13:44.621Z"}