{"attempts":[{"at":"2026-07-22T16:28:32.506Z","detail":null,"eventId":"sha256:2b0e91f850f809d4a52f1505321f1cba888ecf1340e325ca553db0713a86fa31","kind":"ready","outcome":"accepted"},{"at":"2026-07-22T16:30:11.463Z","detail":null,"eventId":"sha256:889474f9411333f4149c292658ce544ff6e575a9e075be8445e90244aaae0978","kind":"dispatch","outcome":"accepted"},{"at":"2026-07-22T16:38:36.443Z","detail":"retired failed shadow dispatch","eventId":"sha256:1e9f45c24473ee72bb751df287cf072f0e97800b4289e26113d8186a7e2a3417","kind":"cancel","outcome":"accepted"}],"createdAt":"2026-07-22T16:28:32.506Z","evidence":[{"digest":"git:9b2d59f9216c8b413e4c3b75cec6a034c80884ba","kind":"execution-ref-protected","url":null}],"executionRef":{"name":"release-execution/8cd517f728f47dae57506f268aaca1fbab24bd8421875bba65bf26623b3d2476","protected":true,"tip":"9b2d59f9216c8b413e4c3b75cec6a034c80884ba"},"occupancyKeys":[],"outbox":[{"claimOwner":null,"createdAt":"2026-07-22T16:28:32.506Z","eventId":"sha256:889474f9411333f4149c292658ce544ff6e575a9e075be8445e90244aaae0978","inputs":{"event_id":"sha256:889474f9411333f4149c292658ce544ff6e575a9e075be8445e90244aaae0978","nonce":"0a2b5883-f507-42a2-9287-a2cd58b8c638","packages_json":"[{\"id\":\"cargo:lenso-contracts\",\"version\":\"0.3.12\"}]","plan_id":"sha256:8cd517f728f47dae57506f268aaca1fbab24bd8421875bba65bf26623b3d2476","plan_sha256":"sha256:c0a0e3fcab7dbf88d378e57b126cdd988c1fc55254a499f705b06cd9fffcf363","release_commit":"9b2d59f9216c8b413e4c3b75cec6a034c80884ba"},"leaseExpiresAt":null,"nonce":"0a2b5883-f507-42a2-9287-a2cd58b8c638","packages":[{"id":"cargo:lenso-contracts","version":"0.3.12"}],"ref":"release-execution/8cd517f728f47dae57506f268aaca1fbab24bd8421875bba65bf26623b3d2476","runUrl":"https://github.com/LioRael/lenso/actions/runs/29938169276","status":"dispatched","updatedAt":"2026-07-22T16:30:11.463Z","workflow":".github/workflows/publish.yml"}],"packages":[{"id":"cargo:lenso-api","phase":6,"requestEventId":null,"status":"pending","version":"0.1.20"},{"id":"cargo:lenso-autonomous-service","phase":3,"requestEventId":null,"status":"pending","version":"0.1.7"},{"id":"cargo:lenso-bootstrap","phase":5,"requestEventId":null,"status":"pending","version":"0.1.19"},{"id":"cargo:lenso-contracts","phase":0,"requestEventId":"sha256:889474f9411333f4149c292658ce544ff6e575a9e075be8445e90244aaae0978","status":"dispatched","version":"0.3.12"},{"id":"cargo:lenso-migrate","phase":6,"requestEventId":null,"status":"pending","version":"0.1.18"},{"id":"cargo:lenso-module-story","phase":4,"requestEventId":null,"status":"pending","version":"0.1.11"},{"id":"cargo:lenso-platform-admin-data","phase":4,"requestEventId":null,"status":"pending","version":"0.1.17"},{"id":"cargo:lenso-platform-admin","phase":4,"requestEventId":null,"status":"pending","version":"0.1.12"},{"id":"cargo:lenso-platform-core","phase":1,"requestEventId":null,"status":"pending","version":"0.1.12"},{"id":"cargo:lenso-platform-http","phase":2,"requestEventId":null,"status":"pending","version":"0.1.11"},{"id":"cargo:lenso-platform-module-remote","phase":4,"requestEventId":null,"status":"pending","version":"0.1.12"},{"id":"cargo:lenso-platform-module","phase":3,"requestEventId":null,"status":"pending","version":"0.1.12"},{"id":"cargo:lenso-platform-runtime","phase":2,"requestEventId":null,"status":"pending","version":"0.1.9"},{"id":"cargo:lenso-platform-testing","phase":2,"requestEventId":null,"status":"pending","version":"0.1.8"},{"id":"cargo:lenso-service","phase":1,"requestEventId":null,"status":"pending","version":"0.1.11"},{"id":"cargo:lenso-worker","phase":6,"requestEventId":null,"status":"pending","version":"0.1.18"},{"id":"cargo:lenso","phase":7,"requestEventId":null,"status":"pending","version":"0.3.26"}],"planId":"sha256:8cd517f728f47dae57506f268aaca1fbab24bd8421875bba65bf26623b3d2476","planSha256":"sha256:c0a0e3fcab7dbf88d378e57b126cdd988c1fc55254a499f705b06cd9fffcf363","previousBlobSha":"27820308c3b65e26b3e0d73a7e3c025f5cc12e71","reason":"retired failed shadow dispatch","receipts":[],"releaseCommit":"9b2d59f9216c8b413e4c3b75cec6a034c80884ba","repository":"LioRael/lenso","revision":3,"schema":"lenso.plan-state.v1","sourceCommit":"ee5d993b8b5d2a738d820512bb68befe3a8f27d5","status":"blocked","updatedAt":"2026-07-22T16:38:36.443Z"}