{"attempts":[{"at":"2026-07-22T20:07:33.185Z","detail":null,"eventId":"sha256:4ecd0586746c4730e1a6dcaed36aef09939a3130e59a8f299f1d2bf252212b62","kind":"ready","outcome":"accepted"},{"at":"2026-07-22T20:07:55.547Z","detail":null,"eventId":"sha256:ca319826e151f02a216618e99ebe16898a0db62a5cd5a04ca192d2d30ca0f0eb","kind":"dispatch","outcome":"accepted"},{"at":"2026-07-22T20:09:31.220Z","detail":"retired failed shadow dispatch","eventId":"sha256:440ab3dab2fe8514df011ed23fc116da3be6d23a5e3de782a4f4fbd72b878a50","kind":"cancel","outcome":"accepted"}],"createdAt":"2026-07-22T20:07:33.185Z","evidence":[{"digest":"git:b2a59c40306be23b1522f9ba4fb7632a40efa21b","kind":"execution-ref-protected","url":null}],"executionRef":{"name":"release-execution/dfcdfd44d6151a4365b2c3d7dc9c9cd440b912ab1bb2497cbf8ba3ee32e321c1","protected":true,"tip":"b2a59c40306be23b1522f9ba4fb7632a40efa21b"},"occupancyKeys":[],"outbox":[{"claimOwner":null,"createdAt":"2026-07-22T20:07:33.185Z","eventId":"sha256:ca319826e151f02a216618e99ebe16898a0db62a5cd5a04ca192d2d30ca0f0eb","inputs":{"event_id":"sha256:ca319826e151f02a216618e99ebe16898a0db62a5cd5a04ca192d2d30ca0f0eb","nonce":"e5cc2fa7-9c57-4231-9eed-99d33e17126b","packages_json":"[{\"id\":\"cargo:lenso-cli\",\"version\":\"0.2.6\"},{\"id\":\"npm:@lenso/cli\",\"version\":\"0.2.6\"}]","plan_id":"sha256:dfcdfd44d6151a4365b2c3d7dc9c9cd440b912ab1bb2497cbf8ba3ee32e321c1","plan_sha256":"sha256:5290a1b037f960a120109b3b70db2cca44aaac4196201851835d710c286726b4","release_commit":"b2a59c40306be23b1522f9ba4fb7632a40efa21b"},"leaseExpiresAt":null,"nonce":"e5cc2fa7-9c57-4231-9eed-99d33e17126b","packages":[{"id":"cargo:lenso-cli","version":"0.2.6"},{"id":"npm:@lenso/cli","version":"0.2.6"}],"ref":"release-execution/dfcdfd44d6151a4365b2c3d7dc9c9cd440b912ab1bb2497cbf8ba3ee32e321c1","runUrl":"https://github.com/LioRael/lenso-cli/actions/runs/29953849427","status":"dispatched","updatedAt":"2026-07-22T20:07:55.547Z","workflow":".github/workflows/publish.yml"}],"packages":[{"id":"cargo:lenso-cli","phase":0,"requestEventId":"sha256:ca319826e151f02a216618e99ebe16898a0db62a5cd5a04ca192d2d30ca0f0eb","status":"dispatched","version":"0.2.6"},{"id":"npm:@lenso/cli","phase":0,"requestEventId":"sha256:ca319826e151f02a216618e99ebe16898a0db62a5cd5a04ca192d2d30ca0f0eb","status":"dispatched","version":"0.2.6"}],"planId":"sha256:dfcdfd44d6151a4365b2c3d7dc9c9cd440b912ab1bb2497cbf8ba3ee32e321c1","planSha256":"sha256:5290a1b037f960a120109b3b70db2cca44aaac4196201851835d710c286726b4","previousBlobSha":"2ca618425c30052d24f84c73fcc2b28deccfe31d","reason":"retired failed shadow dispatch","receipts":[],"releaseCommit":"b2a59c40306be23b1522f9ba4fb7632a40efa21b","repository":"LioRael/lenso-cli","revision":3,"schema":"lenso.plan-state.v1","sourceCommit":"3111a4b28606670253d138bcfa787b4a4ab94849","status":"blocked","updatedAt":"2026-07-22T20:09:31.220Z"}